{
  "test_id": "cfg-007",
  "name": "A profile nobody has is refused 400 VALIDATION_ERROR before anything is read",
  "category": "config-connector",
  "level": "MUST",
  "source": "C-CFG-5",
  "tags": [
    "apply",
    "profile"
  ],
  "requires": [
    "connector_probe"
  ],
  "steps": [
    {
      "kind": "request",
      "method": "POST",
      "path": "/connector/apply",
      "probe": true,
      "body": {
        "profile": "no-such-profile",
        "mode": "test",
        "file_b64": "Lyogc3ludGhldGljIEZIWC1saWtlIHRleHQgZm9yIGNvbnRyYWN0IHRlc3RzOyBub3QgYSB2ZW5kb3IgZmlsZSwgbm90IGEgcmVhbCBwbGFudCAqLwpNT0RVTEUgTkFNRT0iRkFLRV9QVU1QX0EiIHsKICBBVFRSSUJVVEVfSU5TVEFOQ0UgTkFNRT0iU0VUUE9JTlQiIHsgVkFMVUUgeyBDVj0xMC4wIH0gfQogIEFUVFJJQlVURV9JTlNUQU5DRSBOQU1FPSJISV9MSU1JVCIgeyBWQUxVRSB7IENWPTkwLjAgfSB9Cn0KTU9EVUxFIE5BTUU9IkZBS0VfUFVNUF9CIiB7CiAgQVRUUklCVVRFX0lOU1RBTkNFIE5BTUU9IlNFVFBPSU5UIiB7IFZBTFVFIHsgQ1Y9MjAuMCB9IH0KfQo=",
        "changes": [
          {
            "platform": "no-such-profile",
            "item": "FAKE_PUMP_A/SETPOINT",
            "from": "10.0",
            "to": "12.5"
          }
        ]
      },
      "expect": {
        "status": 400,
        "json": [
          {
            "path": "$.error.code",
            "equals": "VALIDATION_ERROR"
          },
          {
            "path": "$.data",
            "absent": true
          }
        ]
      }
    }
  ]
}
